target,text
ham,Even my brother is not like to speak with me. They treat me like aids patent.
ham,"Go until jurong point, crazy.. Available only in bugis n great world la e buffet... Cine there got amore wat..."
spam,WINNER!! As a valued network customer you have been selected to receivea £900 prize reward! To claim call 09061701461. Claim code KL341. Valid 12 hours only.
ham,U dun say so early hor... U c already then say...
ham,"Nah I don't think he goes to usf, he lives around here though"
ham,As per your request 'Melle Melle (Oru Minnaminunginte Nurungu Vettam)' has been set as your callertune for all Callers. Press *9 to copy your friends Callertune
ham,"I'm gonna be home soon and i don't want to talk about this stuff anymore tonight, k? I've cried enough today."
spam,Had your mobile 11 months or more? U R entitled to Update to the latest colour mobiles with camera for Free! Call The Mobile Update Co on 08002986030
